{
  "$schema": "https://json-schema.org/draft/2020-12/schema",
  "$id": "https://oathon.dev/spec/evidence/v0.1/segment-close.schema.json",
  "title": "Oathon Segment Close v0.1",
  "type": "object",
  "required": [
    "spec_version",
    "segment_id",
    "org_id",
    "agent_id",
    "writer_id",
    "segment_sequence",
    "prev_segment_close_hash",
    "first_event_hash",
    "last_event_hash",
    "event_count",
    "first_sequence",
    "last_sequence",
    "opened_at",
    "closed_at",
    "signature"
  ],
  "additionalProperties": false,
  "properties": {
    "spec_version": {
      "const": "0.1"
    },
    "segment_id": {
      "$ref": "#/$defs/uuidv7"
    },
    "org_id": {
      "$ref": "#/$defs/nonEmptyString"
    },
    "agent_id": {
      "$ref": "#/$defs/nonEmptyString"
    },
    "writer_id": {
      "$ref": "#/$defs/uuidv7"
    },
    "segment_sequence": {
      "$ref": "#/$defs/safeNonNegativeInt"
    },
    "prev_segment_close_hash": {
      "oneOf": [
        {
          "$ref": "#/$defs/digest"
        },
        {
          "type": "null"
        }
      ]
    },
    "first_event_hash": {
      "$ref": "#/$defs/digest"
    },
    "last_event_hash": {
      "$ref": "#/$defs/digest"
    },
    "event_count": {
      "type": "integer",
      "minimum": 1,
      "maximum": 9007199254740991
    },
    "first_sequence": {
      "$ref": "#/$defs/safeNonNegativeInt"
    },
    "last_sequence": {
      "$ref": "#/$defs/safeNonNegativeInt"
    },
    "opened_at": {
      "$ref": "#/$defs/timestamp"
    },
    "closed_at": {
      "$ref": "#/$defs/timestamp"
    },
    "signature": {
      "$ref": "#/$defs/signature"
    }
  },
  "$defs": {
    "uuidv7": {
      "type": "string",
      "pattern": "^[0-9a-f]{8}-[0-9a-f]{4}-7[0-9a-f]{3}-[89ab][0-9a-f]{3}-[0-9a-f]{12}$"
    },
    "timestamp": {
      "type": "string",
      "description": "CRYPTO-006: RFC 3339 UTC, millisecond precision",
      "pattern": "^\\d{4}-\\d{2}-\\d{2}T\\d{2}:\\d{2}:\\d{2}\\.\\d{3}Z$"
    },
    "digest": {
      "type": "string",
      "pattern": "^sha256:[A-Za-z0-9_-]{43}$"
    },
    "keyId": {
      "type": "string",
      "pattern": "^ed25519:[A-Za-z0-9_-]{43}$"
    },
    "publicKey": {
      "type": "string",
      "description": "32 raw Ed25519 public-key bytes, base64url no padding (CRYPTO-005)",
      "pattern": "^[A-Za-z0-9_-]{43}$"
    },
    "sigValue": {
      "type": "string",
      "description": "64 Ed25519 signature bytes, base64url no padding",
      "pattern": "^[A-Za-z0-9_-]{86}$"
    },
    "jsonPointer": {
      "type": "string",
      "pattern": "^/(?:[^/~]|~0|~1)*(?:/(?:[^/~]|~0|~1)*)*$"
    },
    "scalar": {
      "type": [
        "string",
        "number",
        "boolean",
        "null"
      ]
    },
    "nonEmptyString": {
      "type": "string",
      "minLength": 1
    },
    "safeNonNegativeInt": {
      "type": "integer",
      "minimum": 0,
      "maximum": 9007199254740991
    },
    "signature": {
      "type": "object",
      "required": [
        "alg",
        "key_id",
        "signed_at",
        "value"
      ],
      "additionalProperties": false,
      "properties": {
        "alg": {
          "const": "Ed25519"
        },
        "key_id": {
          "$ref": "#/$defs/keyId"
        },
        "signed_at": {
          "$ref": "#/$defs/timestamp"
        },
        "value": {
          "$ref": "#/$defs/sigValue"
        }
      }
    },
    "money": {
      "type": "object",
      "required": [
        "minor_units",
        "currency"
      ],
      "additionalProperties": false,
      "properties": {
        "minor_units": {
          "type": "integer",
          "minimum": -9007199254740991,
          "maximum": 9007199254740991
        },
        "currency": {
          "type": "string",
          "pattern": "^[A-Z]{3}$"
        }
      }
    },
    "comparison": {
      "type": "object",
      "required": [
        "path",
        "op",
        "value"
      ],
      "additionalProperties": false,
      "properties": {
        "path": {
          "$ref": "#/$defs/jsonPointer"
        },
        "op": {
          "enum": [
            "eq",
            "neq",
            "lt",
            "lte",
            "gt",
            "gte",
            "in"
          ]
        },
        "value": {}
      },
      "allOf": [
        {
          "if": {
            "properties": {
              "op": {
                "enum": [
                  "eq",
                  "neq"
                ]
              }
            }
          },
          "then": {
            "properties": {
              "value": {
                "$ref": "#/$defs/scalar"
              }
            }
          }
        },
        {
          "if": {
            "properties": {
              "op": {
                "enum": [
                  "lt",
                  "lte",
                  "gt",
                  "gte"
                ]
              }
            }
          },
          "then": {
            "properties": {
              "value": {
                "type": "number"
              }
            }
          }
        },
        {
          "if": {
            "properties": {
              "op": {
                "const": "in"
              }
            }
          },
          "then": {
            "properties": {
              "value": {
                "type": "array",
                "minItems": 1,
                "items": {
                  "$ref": "#/$defs/scalar"
                }
              }
            }
          }
        }
      ]
    },
    "constraint": {
      "oneOf": [
        {
          "type": "object",
          "required": [
            "path",
            "op",
            "value"
          ],
          "additionalProperties": false,
          "properties": {
            "action": {
              "$ref": "#/$defs/nonEmptyString"
            },
            "path": {
              "$ref": "#/$defs/jsonPointer"
            },
            "op": {
              "enum": [
                "eq",
                "neq",
                "lt",
                "lte",
                "gt",
                "gte",
                "in"
              ]
            },
            "value": {}
          },
          "allOf": [
            {
              "if": {
                "properties": {
                  "op": {
                    "enum": [
                      "eq",
                      "neq"
                    ]
                  }
                }
              },
              "then": {
                "properties": {
                  "value": {
                    "$ref": "#/$defs/scalar"
                  }
                }
              }
            },
            {
              "if": {
                "properties": {
                  "op": {
                    "enum": [
                      "lt",
                      "lte",
                      "gt",
                      "gte"
                    ]
                  }
                }
              },
              "then": {
                "properties": {
                  "value": {
                    "type": "number"
                  }
                }
              }
            },
            {
              "if": {
                "properties": {
                  "op": {
                    "const": "in"
                  }
                }
              },
              "then": {
                "properties": {
                  "value": {
                    "type": "array",
                    "minItems": 1,
                    "items": {
                      "$ref": "#/$defs/scalar"
                    }
                  }
                }
              }
            }
          ]
        },
        {
          "type": "object",
          "required": [
            "op",
            "value"
          ],
          "additionalProperties": false,
          "properties": {
            "action": {
              "$ref": "#/$defs/nonEmptyString"
            },
            "op": {
              "const": "max_count_per_utc_day"
            },
            "value": {
              "$ref": "#/$defs/safeNonNegativeInt"
            }
          }
        }
      ]
    }
  }
}
